{
  "bundles": [
    "typescript-library"
  ],
  "documentation": {
    "hotspots": [
      {
        "dimensions": [
          "platform-boundary",
          "security",
          "lifecycle",
          "rationale"
        ],
        "documentation": "docs/architecture.md#bounded-command-execution",
        "id": "bounded-command-execution",
        "source": "src/adapters/command-runner.ts",
        "symbol": "runBoundedCommand",
        "tests": [
          "tests/integration/verify.test.ts"
        ]
      },
      {
        "dimensions": [
          "invariant",
          "algorithm",
          "rationale"
        ],
        "documentation": "docs/architecture.md#module-resolution",
        "id": "module-resolution",
        "source": "src/modules/catalog.ts",
        "symbol": "resolveSelection",
        "tests": [
          "tests/unit/modules/catalog.test.ts"
        ]
      },
      {
        "dimensions": [
          "invariant",
          "lifecycle",
          "security"
        ],
        "documentation": "docs/architecture.md#operation-application",
        "id": "operation-application",
        "source": "src/engine/apply.ts",
        "symbol": "applyOperationPlan",
        "tests": [
          "tests/unit/engine/apply.test.ts",
          "tests/integration/apply-resume.test.ts"
        ]
      },
      {
        "dimensions": [
          "invariant",
          "security",
          "rationale"
        ],
        "documentation": "docs/architecture.md#plan-construction",
        "id": "plan-construction",
        "source": "src/engine/plan.ts",
        "symbol": "createOperationPlan",
        "tests": [
          "tests/unit/engine/plan.test.ts"
        ]
      }
    ]
  },
  "exceptions": [],
  "freshness": {
    "holds": [
      {
        "name": "@types/node",
        "owner": "Threadlabs Studio",
        "reason": "Type declarations intentionally target the minimum supported Node line.",
        "reviewDate": "2027-01-31"
      }
    ]
  },
  "modules": [
    "cross-platform"
  ],
  "ownership": [
    {
      "mode": "local",
      "path": ".gitignore"
    },
    {
      "mode": "local",
      "path": "AGENTS.md"
    },
    {
      "mode": "local",
      "path": "CHANGELOG.md"
    },
    {
      "mode": "local",
      "path": "CLAUDE.md"
    },
    {
      "mode": "local",
      "path": "README.md"
    },
    {
      "mode": "local",
      "path": "oxlint.json"
    },
    {
      "mode": "local",
      "path": "package.json"
    },
    {
      "mode": "local",
      "path": "pnpm-workspace.yaml"
    },
    {
      "mode": "local",
      "path": "src/index.ts"
    },
    {
      "mode": "local",
      "path": "tests/index.test.ts"
    },
    {
      "mode": "local",
      "path": "tests/package.test.ts"
    },
    {
      "mode": "local",
      "path": "tsconfig.build.json"
    },
    {
      "mode": "local",
      "path": "tsconfig.json"
    },
    {
      "mode": "local",
      "path": "vitest.config.ts"
    },
    {
      "mode": "managed",
      "path": ".gitattributes"
    },
    {
      "mode": "managed",
      "path": ".github/dependabot.yml"
    },
    {
      "mode": "managed",
      "path": ".github/workflows/ci.yml"
    },
    {
      "mode": "managed",
      "path": ".github/workflows/extended.yml"
    },
    {
      "mode": "managed",
      "path": ".github/workflows/release.yml"
    },
    {
      "mode": "managed",
      "path": ".threadlabs.lock.json"
    },
    {
      "mode": "managed",
      "path": "LICENSE"
    },
    {
      "mode": "managed",
      "path": "docs/code-documentation-standard.md"
    },
    {
      "mode": "managed",
      "path": "scripts/release.mjs"
    },
    {
      "mode": "managed",
      "path": "threadlabs.config.json"
    }
  ],
  "release": {
    "strategy": "single-package"
  },
  "schemaVersion": "1.0",
  "settings": {
    "description": "An executable, evidence-based standard for open-source repositories.",
    "licenseHolder": "Threadlabs Studio",
    "licenseYear": 2026,
    "projectName": "threadlabs"
  },
  "standardVersion": "1.0.0"
}
